{
  "format": "habits.academic-plan",
  "version": 1,
  "proposalID": "11111111-1111-4111-8111-111111111111",
  "source": "Example only: dates supplied by the user",
  "semester": {
    "id": "22222222-2222-4222-8222-222222222222",
    "title": "Autumn 2026",
    "startDate": "2026-09-14",
    "weekCount": 14,
    "timeZoneIdentifier": "Europe/Zurich"
  },
  "courses": [
    {"id": "33333333-3333-4333-8333-333333333333", "name": "Microeconomics"},
    {"id": "44444444-4444-4444-8444-444444444444", "name": "Statistics"}
  ],
  "assessments": [
    {
      "id": "55555555-5555-4555-8555-555555555555",
      "courseID": "33333333-3333-4333-8333-333333333333",
      "title": "Microeconomics exam",
      "kind": "exam",
      "dueDate": "2026-12-16",
      "dueTime": "09:00",
      "notes": "Example exam date and time supplied by the user."
    },
    {
      "id": "66666666-6666-4666-8666-666666666666",
      "courseID": "44444444-4444-4444-8444-444444444444",
      "title": "Statistics exam",
      "kind": "exam",
      "dueDate": "2026-12-18",
      "notes": "Example date supplied by the user; time is not known."
    }
  ],
  "preparationTasks": [
    {
      "id": "77777777-7777-4777-8777-777777777777",
      "assessmentID": "55555555-5555-4555-8555-555555555555",
      "title": "Work through the practice exam",
      "dueDate": "2026-12-14",
      "dueTime": "18:00",
      "estimatedWorkMinutes": 90,
      "notes": "Example preparation date supplied by the user."
    },
    {
      "id": "88888888-8888-4888-8888-888888888888",
      "assessmentID": "66666666-6666-4666-8666-666666666666",
      "title": "Review the formula sheet",
      "estimatedWorkMinutes": 45,
      "notes": "No preparation date supplied; keep this task undated."
    }
  ]
}
